<?xml version="1.0"?>

<monsters xmlns:xsi="http://www.w3.org/2001/XMLSchema-instance"
	        xsi:noNamespaceSchemaLocation='whq-monster-schema.xsd'>
  <monster id="debug-ogre" name="DEBUG Ogre" plural="DEBUG Ogres">
    <wounds>13</wounds>
    <move>6</move>
    <weaponskill>3</weaponskill>
    <ballisticskill>5</ballisticskill>
    <strength>4</strength>
    <toughness>5</toughness>
    <initiative>3</initiative>
    <attacks>2</attacks>
    <gold>400</gold>
    <armor>0</armor>
    <damage>1D6/2D6(5+)</damage>
    <special>
      <text>This is the text.  It is some very long text.  It goes on and on without end.  Dear Lord, when will this text ever end.  Ah, this looks like the end.
Oh no, that was just a line break!  It still goes on.  Make it stop!!  Make it stop!!!</text>
      <rule id="rpb-ambush-magic">Ambush, Magic A</rule>
      <rule id="rpb-armed-with">Armed with Spears (Str 3)</rule>
      <rule id="rpb-vampire">Vampire</rule>
      <magic id="rpb-necromantic" level="1" />
    </special>
  </monster>
</monsters>
